{
  "frontmatter": {
    "title": "Chelsea 2-1 Bournemouth: Blues Edge Out Cherries in Tense Premier League Finale",
    "description": "Chelsea secured a narrow victory over Bournemouth in the final match of the 2023 Premier League season, with key goals from Caicedo and Sterling proving decisive despite Bournemouth's higher xG.",
    "date": "2024-05-19T15:00:00+00:00",
    "matchId": "1035548",
    "league": "premier-league",
    "teams": [
      "Chelsea",
      "Bournemouth"
    ],
    "tags": [
      "Premier League",
      "Chelsea",
      "Bournemouth",
      "Match Analysis",
      "Tactical Breakdown"
    ],
    "heroImage": "/generated/matches/1035548/shot_proxy.png"
  },
  "match": {
    "id": "1035548",
    "date_utc": "2024-05-19T15:00:00+00:00",
    "league": "Premier League",
    "season": "2023",
    "round": "Regular Season - 38",
    "homeTeam": {
      "id": "49",
      "name": "Chelsea"
    },
    "awayTeam": {
      "id": "35",
      "name": "Bournemouth"
    },
    "score": {
      "home": 2,
      "away": 1,
      "ht_home": 1,
      "ht_away": 0
    },
    "venue": "Stamford Bridge"
  },
  "data_provenance": {
    "provider": "api-football",
    "endpoints_used": [
      "fixtures",
      "fixtures/events",
      "fixtures/lineups",
      "fixtures/players",
      "fixtures/statistics"
    ],
    "fetched_at_utc": "2026-01-28T04:42:14.038278+00:00",
    "availability": {
      "has_events": true,
      "has_statistics": true,
      "has_lineups": true,
      "has_players": true,
      "has_xg": true,
      "has_shot_locations": false
    },
    "notes": [
      "match.* sourced from fixtures (teams, score, venue, kickoff)",
      "timeline[*] sourced from fixtures/events (time, type, team, player, detail)",
      "team_stats.normalized[*].blocked_shots sourced from fixtures/statistics.statistics['Blocked Shots']",
      "team_stats.normalized[*].corners sourced from fixtures/statistics.statistics['Corner Kicks']",
      "team_stats.normalized[*].fouls sourced from fixtures/statistics.statistics['Fouls']",
      "team_stats.normalized[*].gk_saves sourced from fixtures/statistics.statistics['Goalkeeper Saves']",
      "team_stats.normalized[*].offsides sourced from fixtures/statistics.statistics['Offsides']",
      "team_stats.normalized[*].pass_accuracy sourced from fixtures/statistics.statistics['Passes %']",
      "team_stats.normalized[*].passes_total sourced from fixtures/statistics.statistics['Total passes']",
      "team_stats.normalized[*].possession sourced from fixtures/statistics.statistics['Ball Possession']",
      "team_stats.normalized[*].red_cards sourced from fixtures/statistics.statistics['Red Cards']",
      "team_stats.normalized[*].shots_inside_box sourced from fixtures/statistics.statistics['Shots insidebox']",
      "team_stats.normalized[*].shots_off_target sourced from fixtures/statistics.statistics['Shots off Goal']",
      "team_stats.normalized[*].shots_on_target sourced from fixtures/statistics.statistics['Shots on Goal']",
      "team_stats.normalized[*].shots_outside_box sourced from fixtures/statistics.statistics['Shots outsidebox']",
      "team_stats.normalized[*].total_shots sourced from fixtures/statistics.statistics['Total Shots']",
      "team_stats.normalized[*].xg sourced from fixtures/statistics.statistics['expected_goals']",
      "team_stats.normalized[*].yellow_cards sourced from fixtures/statistics.statistics['Yellow Cards']",
      "players[*] sourced from fixtures/players.statistics",
      "players[*].rating sourced from fixtures/players.statistics[].games.rating",
      "players[*].shots sourced from fixtures/players.statistics[].shots.total",
      "players[*].key_passes sourced from fixtures/players.statistics[].passes.key",
      "players[*].passes sourced from fixtures/players.statistics[].passes.accuracy",
      "players[*].tackles sourced from fixtures/players.statistics[].tackles.total",
      "players[*].duels_won sourced from fixtures/players.statistics[].duels.won"
    ]
  },
  "timeline": [
    {
      "minute": 17,
      "type": "goal",
      "teamId": "49",
      "teamName": "Chelsea",
      "playerId": "116117",
      "playerName": "M. Caicedo",
      "assistId": null,
      "assistName": null,
      "detail": "Normal Goal",
      "score_after": {
        "home": 1,
        "away": 0
      }
    },
    {
      "minute": 27,
      "type": "card",
      "teamId": "49",
      "teamName": "Chelsea",
      "playerId": "47380",
      "playerName": "Marc Cucurella",
      "assistId": null,
      "assistName": null,
      "detail": "Yellow Card",
      "score_after": null
    },
    {
      "minute": 27,
      "type": "card",
      "teamId": "35",
      "teamName": "Bournemouth",
      "playerId": "19281",
      "playerName": "Antoine Semenyo",
      "assistId": null,
      "assistName": null,
      "detail": "Yellow Card",
      "score_after": null
    },
    {
      "minute": 30,
      "type": "card",
      "teamId": "35",
      "teamName": "Bournemouth",
      "playerId": "206254",
      "playerName": "Milo\u0161 Kerkez",
      "assistId": null,
      "assistName": null,
      "detail": "Yellow Card",
      "score_after": null
    },
    {
      "minute": 48,
      "type": "goal",
      "teamId": "49",
      "teamName": "Chelsea",
      "playerId": "645",
      "playerName": "R. Sterling",
      "assistId": "152982",
      "assistName": "C. Palmer",
      "detail": "Normal Goal",
      "score_after": {
        "home": 2,
        "away": 0
      }
    },
    {
      "minute": 49,
      "type": "goal",
      "teamId": "35",
      "teamName": "Bournemouth",
      "playerId": "95",
      "playerName": "B. Badiashile",
      "assistId": null,
      "assistName": null,
      "detail": "Own Goal",
      "score_after": {
        "home": 2,
        "away": 1
      }
    },
    {
      "minute": 59,
      "type": "subst",
      "teamId": "35",
      "teamName": "Bournemouth",
      "playerId": "19245",
      "playerName": "M. Tavernier",
      "assistId": "284797",
      "assistName": "Dango Ouattara",
      "detail": "Substitution 1",
      "score_after": null
    },
    {
      "minute": 60,
      "type": "subst",
      "teamId": "35",
      "teamName": "Bournemouth",
      "playerId": "792",
      "playerName": "J. Kluivert",
      "assistId": "18883",
      "assistName": "D. Solanke",
      "detail": "Substitution 2",
      "score_after": null
    },
    {
      "minute": 64,
      "type": "subst",
      "teamId": "49",
      "teamName": "Chelsea",
      "playerId": "116117",
      "playerName": "M. Caicedo",
      "assistId": "270508",
      "assistName": "L. Ugochukwu",
      "detail": "Substitution 1",
      "score_after": null
    },
    {
      "minute": 64,
      "type": "subst",
      "teamId": "49",
      "teamName": "Chelsea",
      "playerId": "645",
      "playerName": "R. Sterling",
      "assistId": "269",
      "assistName": "C. Nkunku",
      "detail": "Substitution 2",
      "score_after": null
    },
    {
      "minute": 64,
      "type": "subst",
      "teamId": "49",
      "teamName": "Chelsea",
      "playerId": "136723",
      "playerName": "N. Madueke",
      "assistId": "161907",
      "assistName": "M. Gusto",
      "detail": "Substitution 3",
      "score_after": null
    },
    {
      "minute": 69,
      "type": "subst",
      "teamId": "35",
      "teamName": "Bournemouth",
      "playerId": "19070",
      "playerName": "M. Aarons",
      "assistId": "304853",
      "assistName": "A. Scott",
      "detail": "Substitution 3",
      "score_after": null
    },
    {
      "minute": 70,
      "type": "subst",
      "teamId": "35",
      "teamName": "Bournemouth",
      "playerId": "47499",
      "playerName": "E. \u00dcnal",
      "assistId": "2734",
      "assistName": "P. Billing",
      "detail": "Substitution 4",
      "score_after": null
    },
    {
      "minute": 78,
      "type": "card",
      "teamId": "49",
      "teamName": "Chelsea",
      "playerId": "161907",
      "playerName": "Malo Gusto",
      "assistId": null,
      "assistName": null,
      "detail": "Yellow Card",
      "score_after": null
    },
    {
      "minute": 80,
      "type": "card",
      "teamId": "35",
      "teamName": "Bournemouth",
      "playerId": "6610",
      "playerName": "Marcos Senesi",
      "assistId": null,
      "assistName": null,
      "detail": "Yellow Card",
      "score_after": null
    },
    {
      "minute": 84,
      "type": "subst",
      "teamId": "35",
      "teamName": "Bournemouth",
      "playerId": "6610",
      "playerName": "M. Senesi",
      "assistId": "19263",
      "assistName": "L. Kelly",
      "detail": "Substitution 5",
      "score_after": null
    },
    {
      "minute": 89,
      "type": "subst",
      "teamId": "49",
      "teamName": "Chelsea",
      "playerId": "152982",
      "playerName": "C. Palmer",
      "assistId": "270507",
      "assistName": "C. Casadei",
      "detail": "Substitution 4",
      "score_after": null
    }
  ],
  "team_stats": {
    "raw": {
      "49": {
        "team": {
          "id": 49,
          "name": "Chelsea",
          "logo": "https://media.api-sports.io/football/teams/49.png"
        },
        "statistics": [
          {
            "type": "Shots on Goal",
            "value": 6
          },
          {
            "type": "Shots off Goal",
            "value": 4
          },
          {
            "type": "Total Shots",
            "value": 16
          },
          {
            "type": "Blocked Shots",
            "value": 6
          },
          {
            "type": "Shots insidebox",
            "value": 11
          },
          {
            "type": "Shots outsidebox",
            "value": 5
          },
          {
            "type": "Fouls",
            "value": 5
          },
          {
            "type": "Corner Kicks",
            "value": 6
          },
          {
            "type": "Offsides",
            "value": 0